{
  "$schema": "https://json-schema.org/draft/2020-12/schema",
  "description": "Rows a request may bring for the invoices app: { table: [row] }. Generated by scripts/gen-schemas.ts; do not edit.",
  "type": "object",
  "properties": {
    "customers": {
      "type": "array",
      "items": {
        "type": "object",
        "properties": {
          "$key": {
            "type": "string",
            "minLength": 1,
            "description": "This row's name within the request, for $ref"
          },
          "name": {
            "type": "string"
          },
          "gstin": {
            "type": [
              "string",
              "null"
            ]
          },
          "email": {
            "type": [
              "string",
              "null"
            ]
          },
          "phone": {
            "type": [
              "string",
              "null"
            ]
          },
          "address": {
            "type": [
              "string",
              "null"
            ]
          }
        },
        "required": [
          "$key",
          "name"
        ],
        "additionalProperties": false
      }
    },
    "invoices": {
      "type": "array",
      "items": {
        "type": "object",
        "properties": {
          "$key": {
            "type": "string",
            "minLength": 1,
            "description": "This row's name within the request, for $ref"
          },
          "number": {
            "type": "string"
          },
          "customer_id": {
            "anyOf": [
              {
                "type": "string"
              },
              {
                "type": "object",
                "properties": {
                  "$ref": {
                    "type": "string",
                    "pattern": "^customers/.+"
                  }
                },
                "required": [
                  "$ref"
                ],
                "additionalProperties": false
              }
            ]
          },
          "issue_date": {
            "type": "string"
          },
          "due_date": {
            "type": "string"
          },
          "status": {
            "type": "string",
            "enum": [
              "draft",
              "sent",
              "paid",
              "overdue",
              "void"
            ]
          },
          "notes": {
            "type": [
              "string",
              "null"
            ]
          }
        },
        "required": [
          "$key",
          "number",
          "customer_id",
          "issue_date",
          "due_date"
        ],
        "additionalProperties": false
      }
    },
    "invoice_lines": {
      "type": "array",
      "items": {
        "type": "object",
        "properties": {
          "$key": {
            "type": "string",
            "minLength": 1,
            "description": "This row's name within the request, for $ref"
          },
          "invoice_id": {
            "anyOf": [
              {
                "type": "string"
              },
              {
                "type": "object",
                "properties": {
                  "$ref": {
                    "type": "string",
                    "pattern": "^invoices/.+"
                  }
                },
                "required": [
                  "$ref"
                ],
                "additionalProperties": false
              }
            ]
          },
          "description": {
            "type": "string"
          },
          "qty": {
            "type": "number",
            "minimum": -140737488355328,
            "maximum": 140737488355327
          },
          "unit_price": {
            "type": "number",
            "minimum": -140737488355328,
            "maximum": 140737488355327
          },
          "gst_rate": {
            "type": "number",
            "minimum": -140737488355328,
            "maximum": 140737488355327
          }
        },
        "required": [
          "$key",
          "invoice_id",
          "description"
        ],
        "additionalProperties": false
      }
    },
    "payments": {
      "type": "array",
      "items": {
        "type": "object",
        "properties": {
          "$key": {
            "type": "string",
            "minLength": 1,
            "description": "This row's name within the request, for $ref"
          },
          "invoice_id": {
            "anyOf": [
              {
                "type": "string"
              },
              {
                "type": "object",
                "properties": {
                  "$ref": {
                    "type": "string",
                    "pattern": "^invoices/.+"
                  }
                },
                "required": [
                  "$ref"
                ],
                "additionalProperties": false
              }
            ]
          },
          "date": {
            "type": "string"
          },
          "amount": {
            "type": "number",
            "minimum": -140737488355328,
            "maximum": 140737488355327
          },
          "method": {
            "type": "string",
            "enum": [
              "upi",
              "bank",
              "cash",
              "card"
            ]
          },
          "ref": {
            "type": [
              "string",
              "null"
            ]
          }
        },
        "required": [
          "$key",
          "invoice_id",
          "date",
          "amount"
        ],
        "additionalProperties": false
      }
    }
  },
  "additionalProperties": false
}
